Discipline,Effect,Description
Social Psychology,Scarcity effect - Decision making,* **Scarcity effect - _Decision making. _** Lacking time or money can lead to making worse decisions.​
Social Psychology,Scarcity effect - Opportunity costs,* **Scarcity effect** **- _Opportunity costs._** Poor people are more likely to consider opportunity costs spontaneously.
Social Psychology,Scarcity effect - Conscious thoughts,* **Scarcity effect -_ Conscious thoughts._** Thoughts triggered by financial concerns intrude more often  into consciousness of poorer individuals than for wealthier individuals.​
Social Psychology,Scarcity effect - Absoluteness of losses,"* **Scarcity effect -_ Absoluteness of losses_.** Poorer individuals view losses in more absolute, rather than relative, terms than do wealthier individuals.​"
Social Psychology,Bottomless soup bowl,Visual cues related to portion size increase intake volume of soup.
Social Psychology,Simon effect,Faster responses are observed when the stimulus and response are on the same side than when the stimulus and response are on opposite sides.
Social Psychology,ERPs in lie detection - P300 and guilty knowledge,"* **ERPs in lie detection**. Particularly the P300 ERP component has been related in literature using Guilty Knowledge Tests to conscious recognition of crime-related targets as meaningful and salient stimuli, based on crime-related episodic memories."
Social Psychology,Evaluative conditioning,"Implicit and explicit attitudes are differently sensitive to different kinds of information. Explicit attitude are formed and changed in response to the valence of consciously accessible, verbally presented behavioural information and implicit attitudes are formed and changed in response to the valence of subliminally presented primes.​"
Social Psychology,Bilingual deficit in lexical retrieval,"Compared to monolinguals, bilinguals have often been found to be slower or less accurate in accessing the meaning of a certain word or the word for a certain representation under certain conditions.   ​"
Social Psychology,Nostalgia as a positive emotional experience,"* **Nostalgia** **as a positive emotional experience. **A predominantly positive, albeit bittersweet emotion that arises from personally relevant and longful memories of one’s past. Nostalgia was once considered a disease or mental illness, but it has been shown to counteract loneliness, boredom and anxiety."
Social Psychology,Spacing effect,Long-term memory is enhanced when learning events are spaced apart in time rather than massed in immediate succession.​
Social Psychology,False memories - eyewitness testimony,A phenomenon of recalling a real event that differs from what actually happened or an event that never occurred.
Social Psychology,Context-dependent memories,The improved recall or recognition of information when cues in the environment are the same during both encoding and retrieval.
Social Psychology,Motor priming,"Motor priming refers to the phenomenon where a previous motor action influences the subsequent execution of a motor task. Scientific findings have shown that motor priming can have a moderate to large effect on task performance. It's also important to note that the effect size of motor priming can depend on the specific task being used, the population being studied, and the experimental design."
Social Psychology,Associative priming,"Involves using two stimuli that are normally associated with one another. For example, “apple” and “tree” are two words that can be linked with one another in memory, so if only one of the words appears, it can prime the subject to respond more rapidly when the second word appears."
Social Psychology,Repetition priming,"* **Repetition priming**, classification or identification of stimulus is improved when the same stimulus has been presented previously."
Social Psychology,Semantic priming,"* **Semantic priming**, a facilitation in responding to target words such as doctor when preceded by a semantically related prime such as nurse than a semantically unrelated prime such as bread."
Social Psychology,Masked priming,A visual prime is presented followed by a visual mask at the same position or surrounding the same position.
Social Psychology,Flanker task,The Flanker task is a measure of inhibition of prepotent responses. Response times to target stimuli flanked by irrelevant stimuli of the opposite response set (incongruent) are significantly more impaired than when they are flanked by irrelevant stimuli of the same response set (congruent).
Social Psychology,Mere Exposure Effect,Participants who are repeatedly exposed to the same stimuli rate them more positively than stimuli that have not been presented before.
Social Psychology,Cocktail Party Effect,Participants hear their own name being presented in the irrelevant message during a dichotic listening task.
Social Psychology,Mental simulation - mismatch advantage: object colour,* **Mental simulation (mismatch advantage: object colour)**. Readers verify pictures more quickly when they match rather than mismatch the object colour from the preceding sentence.
Social Psychology,Mental simulation - match advantage object orientation,Readers verify pictures more quickly when they match rather than mismatch the object orientation from the preceding sentence.
Social Psychology,Mental simulation - match advantage object distance,"Readers verify small pictures more quickly when they are far from the protagonist, in contrast to big pictures, while big pictures are verified more quickly when closer to the protagonist, as opposed to smaller pictures."
Social Psychology,Mental simulation - match advantage object number,Verification response was faster for concept-object match when there was numerical congruence (compared with incongruence) between the number word and quantity.
Social Psychology,Mental simulation - match advantage object shape,Readers verify pictures more quickly when they match rather than mismatch the object shape from the preceding sentence.
Social Psychology,Mental simulation - match advantage object size,"Readers verify small imagined pictures more quickly when they are small real pictures, in contrast to big real pictures, while big imagined pictures are verified more quickly when they are big real pictures, as opposed to big imagined pictures.​"
Social Psychology,Mental simulation - bigger is better effect,* **Mental simulation - bigger is better effect.** Items that are big in real size are processed more quickly than items that are small in real size. ​
Social Psychology,Transposed word effect,* **Transposed word effect.** Responses to transposed word sequences (e.g. “you that read wrong”) are more error-prone and judged as ungrammatical compared with a control sequence (e.g. “you that read worry”).
Social Psychology,Personality > intelligence predicting life outcomes,"Personality is generally more predictive than IQ on a variety of important life outcomes, such as educational attainment and wage."
Social Psychology,Error salience effects,* **Error salience **(epistemic contextualism effects). Judgments about “knowledge” are sensitive to the salience of error possibilities. This is explained by the fact that salience shifts the evidential standard required to truthfully say someone “knows” something when those possibilities are made salient.​
Social Psychology,Gettier intuition effect,Participants attributed knowledge in Gettier-type cases (where an individual is justified in believing something to be true but their belief was only correct due to luck) at rates similar to cases of justified true belief.
Social Psychology,Left-cradling bias,* **Left cradling bias** (child cradling lateralization). Humans preferentially hold their child on the left body side. This is hypothesised to be modulated by handedness as the dominant hand is preferably free for mundane tasks.
Social Psychology,Handedness differences - Schizophrenia,* **Handedness differences - schizophrenia**. Non-right-handedness is more prevalent in individuals with schizophrenia compared to the healthy population.
Social Psychology,Handedness differences - depression,* **Handedness differences - depression. **Being left-handed is associated with a higher likelihood of being depressed.
Social Psychology,Handedness differences - stuttering,* **Handedness differences - stuttering. **The rate of stuttering was much higher in left-handers than in right-handers.
Social Psychology,Handedness differences - dyslexia,* **Handedness differences - dyslexia. **The rate of learning disabilities was much higher in left-handers than in right-handers. ​
Social Psychology,Handedness differences - intelligence,* **Handedness differences - intelligence.** Left-handedness is associated with lower scores in fluid intelligence.
Social Psychology,Handedness differences - cognitive ability,* **Handedness differences - cognitive ability. **Difference in spatial ability between left and right handers. Left handers have a supposed deficit in spatial ability.
Social Psychology,Handedness differences - sexual orientation,"* **Handedness differences - sexual orientation. **Intrauterine testosterone levels may determine both handedness and sexuality, with homosexuals having an increased rate of left-handedness."
Social Psychology,Handedness differences - twins,* **Handedness differences - twins. **Handedness differences between twins and singletons. Twins have been suggested to show increased rates of  left handedness compared to singletons.​
Social Psychology,Handedness differences - sex,* **Handedness differences - sex. **Handedness differences between men and women. Men have been suggested to show increased rates of left-handedness compared to women.
Social Psychology,Overlooking of subtractive change,"* **Overlooking of subtractive change. **People systematically default to searching for additive transformations, and consequently overlook subtractive transformations. A tendency to generate and/or select additive ideas over subtractive ones."
Social Psychology,Heterogeneity reduces perceived quantity,"Sets of multiple colourful or different objects (e.g., stars, squares, triangles) seem less with respect to their quantity than the same sets that consist of only one type of object (e.g., only red triangles)."
Social Psychology,Eye movement and false memories,* **Eye movements and false memories. **Lateral eye movements increase false memory rates.
Social Psychology,Gaze-liking effect,"People are more likely to rate objects as more likeable when they have seen a person repeatedly gaze toward, as opposed to away from the object."
Social Psychology,Phonological working memory impairment in dyslexic adults,"Dyslexic individuals show lower scores on phonological working memory, using a nonword repetition task. ​"
Social Psychology,Phonological monitoring impairment in dyslexic adults,"* **Phonological monitoring impairment in dyslexic adults**, dyslexic show lower scores on phonological monitoring than neurotypical adults. ​"
Social Psychology,Phonological awareness impairment in dyslexic adults,Dyslexic show lower scores on phonological awareness than neurotypical adults.
Social Psychology,Phonemic fluency impairment in dyslexic adults,"Dyslexic adults show lower scores on phonemic fluency tasks than neurotypical adults. Phonemic fluency tasks are a type of verbal fluency task, where people are asked to generate as many words as possible according to a specific criterion relating to phonemes, for instance words starting with the letter ‘M’."
Social Psychology,Semantic fluency impairment in dyslexic adults,"Dyslexic adults show lower scores on semantic fluency than neurotypical adults. Semantic fluency tasks are a type of verbal fluency task, where people are asked to generate as many words as possible according to a specific criterion, for instance items that are part of the same category, such as foods."
Social Psychology,Lexical precision on lexical competition,* **Lexical precision lexical competition. **The direction and magnitude of inhibitory priming in word targets with dense neighbourhoods is moderated by spelling.
Social Psychology,Placebo effect,"* **Placebo Effect. **Refers to the phenomenon in which a treatment or intervention that has no specific therapeutic effect (such as a sugar pill or saline injection) can still produce a therapeutic response in some individuals. The concept of the placebo effect can be traced back to the 18th century, when physicians and researchers began to notice that patients often reported improvements in their symptoms after receiving treatments that did not have any known physiological effects."
Social Psychology,Placebo empathy analgesia,Downregulating first-hand pain perception via placebo analgesia (administration of an inert treatment such as a sugar pill)​ also dampens empathy for another person in pain.
Social Psychology,Nocebo effect,* **Nocebo effect. **This phenomenon is said to occur when negative expectations of an individual about an experience (e.g. a medical treatment) cause the experience to have a more negative effect than it would have otherwise.
Social Psychology,Stroop effect,"* **Stroop Effect. **A phenomenon in which it takes longer to name the ink colour of a word when the word itself is a colour name that is different from the ink colour (e.g. the word ""red"" printed in blue ink). The Stroop effect is considered a classic demonstration of the interference between different types of information processing."
Social Psychology,Disfluency effect,"Disfluency, the subjective experience of difficulty associated with cognitive operations, leads to deeper cognitive processing. If information is processed with difficulty or disfluently (e.g. when written in hard-to-read fonts), this experience serve as a cue that the task is difficult or that one’s intuitive (System 1) response is likely to be wrong, thereby activating more elaborate (System 2) processing, resulting in more positive cognitive outcomes.​"
Social Psychology,Retrieval-induced forgetting,* **Retrieval-induced forgetting **(RIF). Forgetting of some items is in part a consequence of remembering other items.
Social Psychology,Mood-dependent retrieval,"* **Mood-dependent retrieval **(mood-dependent memory, state dependent memory, encoding specificity). Memory is enhanced when an individual’s mood (i.e., emotional state) at retrieval matches their mood at encoding."
Social Psychology,Positive emotions broaden scope of attention,People experiencing positive emotions exhibit broader scopes of attention than do people experiencing no particular emotion.
Social Psychology,Emotional information facilitates response inhibition,"Response inhibition refers to suppression of prepotent responses which are inappropriate to current task demands. In the lab setting, this is investigated with a stop signal task. The effect showed that both fearful and happy faces as stop signals facilitated response inhibition relative to neutral ones."
Social Psychology,Inhibition-induced devaluation,"* **Inhibition induced devaluation.** Inhibition-induced devaluation refers to reduced response to stimuli which were previously inhibited. This effect results in participants bidding less for shapes that were paired with stop-signals, giving less trustworthiness rating for faces previously paired with stop signals. This effect has several implications for behaviour modification techniques."
Social Psychology,Inhibition induced forgetting,* **Inhibition induced forgetting.** Inhibition-induced forgetting refers to impaired memory for the stimuli to which responses were inhibited.
Social Psychology,Semantic Richness Effects in Lexical-Semantic Processing: Body-object Interaction Effect,"* **Body-object interaction (BOI) effect in lexical-semantic processing.** Words that have higher ratings on the BOI measure receive faster responses (RTs) in lexical-semantic tasks (e.g., lexical decision, semantic decision). The BOI quantifies the ease with which the human body can physically interact with a word’s referent. The BOI effect is thought to show that sensorimotor information contributes to word meaning, providing support for embodied theories of semantic representation."
Social Psychology,False memory implantation,"* **False memory implantation (false memory fabrication). **People fabricate false memories after the suggestion that it happened. After discussing their memories with a researcher, participants reported a false memory."
Social Psychology,Serial dependence,"Serial dependence describes a visual bias that a reported item (e.g., orientation) is systematically attracted towards the previous reported item."
Social Psychology,Modality-switching cost,"* **Modality-switching cost** (modality switch effect). When verifying object properties, processing is slowed when the modality being processed is different from the modality processed in the preceding trial. The presence of the switching cost suggests that people represent semantic information in a modality-specific, rather than amodal or abstract, manner.​"
Social Psychology,Tactile Disadvantage,"* **Tactile Disadvantage **(conceptual tactile disadvantage). Participants find it more difficult and are slower to process words strongly related to the tactile modality (e.g., _sticky_), compared to processing words from other modalities (visual, auditory etc.). The presence of this conceptual tactile disadvantage mirrors a similar disadvantage observed in perceptual processing, where tactile stimuli are slower and more difficult to process than visual or auditory stimuli.​"
Social Psychology,Perceptual strength in lexical processing,* **Perceptual strength in lexical processing **(visual lexical decision task). Concepts that are rated as being more strongly linked to perceptual experience are processed more quickly than those more weakly linked to perceptual experience. This pattern suggests a sensory basis for conceptual representations.​
Social Psychology,Semantic richness in lexical processing,"* **Semantic richness in lexical processing **(visual lexical decision task). Concepts that are associated with a larger amount of semantic information (e.g., larger number of features, greater semantic neighbourhood density) are processed more quickly in tasks that require semantic processing. This pattern suggests that richer semantic representations (i.e., more semantic information) facilitate semantic processing."
Social Psychology,Temporal doppler effect,Subjective perception that the past is further away than the future.
Social Psychology,Contextual cueing,"Compared to novel contexts (i.e., spatial arrangements), repeated contexts yield faster response times in visual search without consciously recognizing the context as repeated."
Social Psychology,Search initiation effect,"In a repeated search task, the very first search takes substantially longer than all subsequent searches, implying that most information is processed and learned during the first search which can then be used to guide subsequent searches efficiently.​"
Social Psychology,Attentional blink,"The attentional blink describes the phenomenon that in a rapid serial visual presentation ​of items, humans show a reduced ability to detect the second of two targets among distractors if the second target follows after approximately 200ms – 500ms after the first target. This effect is interpreted as displaying one of the limitations of human visual processing."
Social Psychology,Emotional attentional blink,"* **Emotional attentional blink** (emotion-induced blindness). Similar to the attentional blink, a target among distractors in a rapid serial visual presentation of images is missed, if it was preceded by an emotionally arousing image. Importantly and in contrast to the attentional blink phenomenon, the emotionally ​arousing image is task-irrelevant."
Social Psychology,Growth mindset,* **Growth mindset.** Thinking that skill is improvable on attainment.
Social Psychology,"Expertise attained after 10,000 hours practice","The notion that it takes around 10,000 hours of practice to become an expert in a particular field or domain. Specifically, that deliberate practice explains from most to all of the variance in (expert) performance in sports."
Social Psychology,Tailoring to learning styles,* **Tailoring to learning styles.** Tailoring teaching to students’ preferred learning styles has any effect on objective measures of attainment.
Social Psychology,Neonate imitation,Babies are born with the ability to imitate.
Social Psychology,Violent media content on aggression,"Violence content in media can affect people to be more aggressive. Notably, the studies of this effect differ by media (TV, games, etc.) and whether long, medium, or short-term effects have been investigated. The variety of methods/tests further complicates the literature. Distinct media types are marked for each reference below."
Social Psychology,Mutual exclusivity bias,"When presented with two objects, one of which has a known label and one which does not, infants (by ~20mo) are more likely to choose the object without a known label when prompted with a novel label."
Social Psychology,Mutual exclusivity bias - bilinguals,* **Mutual exclusivity bias in bilinguals**. Bilingual (and multilingual) infants exhibit delayed and/or lower mutual exclusivity bias than monolingual infants.
Social Psychology,Abstract rule learning,"After training on strings on stimuli generated from a particular repetition pattern (e.g., AAB), young infants attend longer to novel stimuli generated from a novel pattern (e.g., ABA) than novel stimuli generated from the original pattern."
Social Psychology,Theory of mind – below-4 year olds,* **Theory of mind in below-4 year olds **(false belief). Children under four years of age fail at theory of mind tasks.
Social Psychology,Theory of mind – over development,* **Theory of mind over development** (false belief). Success rate at theory of mind tasks increases over age within the first 6 years of life.
Social Psychology,Preference for prosocial agents,Infants and toddlers prefer prosocial agents over neutral or antisocial agents.
Social Psychology,Flynn effect,The observed rise over time in standardised intelligence test scores in the successive versions of Stanford-Binet and Wechsler intelligence tests. This effect points toward an increase in “intelligence” in the next generation compared to the previous generation.
Social Psychology,Do children overhear to learn new words?,* **Do children overhear to learn new words?** Children were equally good at learning novel words- when they were overhearers as when they were directly addressed.
Social Psychology,2D:4D ratio of the fingers,"* **2D:4D ratio of the fingers and its correlation with psychological traits. **This ratio was used as a predictor for different interindividual (e.g., intelligence) and especially gender differences."
Social Psychology,Personality traits and consequential life outcomes,"Personality traits (i.e., characteristic patterns of thinking, feeling, or behaving that tends to be consistent over time and across relevant situations), particularly the Big Five factors, are linked with consequential individual, interpersonal, and social-institutional outcomes."
Social Psychology,Reading prevents cancer,Combining bibliotherapy and short-term individual therapy can reduce the probability of dying from cancer and may prolong lives of those already suffering from cancer.​
Social Psychology,Graphology,The analysis of handwriting with the attempt to determine someone’s personality traits.
Social Psychology,Default effect,"* **Default effect. **In a choice scenario between two alternatives, when an alternative is presented as a default option, people stick with it rather than change it. For example, 'Opt Out' default organ donation policies increase organ donations."
Social Psychology,Decoy effect,"* **Decoy effect **(alternatives: asymmetric dominance; attraction effect). The Decoy Effect is a cognitive bias in which an individual's preference between two options is influenced by the presence of a third, asymmetrically dominated  option (i.e., a decoy similar but inferior to one of the original options). Individuals are more likely to choose the option that is similar to the decoy option than if the decoy were absent. Decoy effect has been replicated in different studies and contexts, though the magnitude of the effect can vary, particularly depending on the specific features of the options being considered and the context in which the decisions are being made."
Social Psychology,Nudges,* **Nudges.** Choice architecture interventions that promote beneficial decisions.
Social Psychology,Risky choice framing effect,"* **Risky choice framing effect **(term used by Levin et al., 1998) (framing effect in risky-decision making). Under loss-frame, people are risk-seeking, whereas under gain-frame, people are risk-averse. In framing studies, logically equivalent choice situations are differently described and the resulting preferences are studied. In risky choice problems, the way a choice is presented influences the decision (e.g. saving 10 people out of 100 vs losing 90 people out of 100)."
