Discipline,Effect,Description
Social Psychology,Elderly priming,that hearing about old age makes people walk slower.
Social Psychology,Hostility priming (unscrambled sentences),Exposing participants to more hostility-related stimuli caused them subsequently to interpret ambiguous behaviours as more hostile.
Social Psychology,Intelligence priming (contemplation),* **Intelligence priming (contemplation) (professor priming).** Participants primed with a category associated with intelligence (e.g. “professor”) performed 13% better on a trivia test than participants primed with a category associated with a lack of intelligence (“soccer hooligans”).
Social Psychology,Moral priming (cleanliness),Participants exposed to physical cleanliness were shown to reduce the severity of their moral judgments.
Social Psychology,Moral priming (contemplation),Participants exposed to a moral-reminder prime would demonstrate reduced cheating.
Social Psychology,Distance priming,"Participants primed with distance compared to closeness produced greater enjoyment of media depicting embarrassment (Study 1), less emotional distress from violent media (Study 2), lower estimates of the number of calories in unhealthy food (Study 3), and weaker reports of emotional attachments to family members and hometowns (Study 4)."
Social Psychology,Flag priming,* **Flag priming. **Participants primed by a flag are more likely to be more in conservative positions than those in the control condition.
Social Psychology,Fluency priming,"* **Fluency priming. **Objects that are fluent (e.g., conceptually fluent, visually fluent) are perceived more concretely than objects that are disfluent (disfluent objects are perceived more abstractly)."
Social Psychology,Money priming,"Images or phrases related to money cause increased faith in capitalism, and the belief that victims deserve their fate."
Social Psychology,Commitment priming (recall),Participants exposed to a high-commitment prime would exhibit greater forgiveness.
Social Psychology,Mortality Salience,"* **Mortality Salience** (Death Priming/Terror Management Theory). Reminders of death lead to subconscious changes in attitudes and behaviour, for example in the form of increased in-group bias and behaviour that serves to defend an individual’s cultural worldview."
Social Psychology,Spatial priming for emotional closeness,Plotting points closer together led to participants reporting they were closer to their own family members than those who plotted points farther apart.
Social Psychology,Implicit God prime increases self-reported risky behaviour,Implicitly priming God using the scrambled-sentence paradigm increases self-reported risk taking.
Social Psychology,Implicit God prime increases actual risky behaviour,Implicitly priming God using the scrambled-sentence paradigm increases willingness to engage in risky behaviour for financial reward.
Social Psychology,Implicit religious priming,Implicitly priming god concepts by unscrambling sentences with words relating to religion increases prosocial behaviour in an anonymous economic game.
Social Psychology,Heat priming,Exposure to words related to hot temperatures increases aggressive thoughts and hostile perceptions. This effect suggests that people mentally associate heat-related constructs with aggression-related constructs.
Social Psychology,Honesty priming,"* **​​Honesty priming** (goal-priming, social priming). An increased level of honesty to embarrassing behaviours after exposure to honesty-related words."
Social Psychology,Achievement priming,"* **Achievement priming **(goal priming, high-performance goal priming). Exposing individuals to words that are success oriented (e.g., win, strive) will increase their performance on a task compared to those exposed to neutral words (e.g., carpet, shampoo).​"
Social Psychology,Weapons priming effect,"* **Weapons priming effect **(weapons effect). Stimuli or cues associated with aggression, such as weapons, can elicit aggressive responses."
Social Psychology,Goal priming effect,"* **Goal priming effect** (goal contagion, goal inspiration, behavioural inspiration). The observation of other’ behaviour (e.g., your observe someone jogging in the park) may lead to the inference of the goal in the observer (“This person wants to keep fit.”) and to the adoption of the same goal (“Maybe I should do some sports too.”)."
Social Psychology,Olfactory priming of cleaning behaviour,"* **Olfactory priming of cleaning behaviour** (scent priming, sensory priming). People who were exposed to a lemon scent were more likely to engage in a range of cleaning-related behaviours and have more rapid access to cleaning-related concepts, compared to people who were not exposed to a lemon-scent. This finding suggests that olfactory cues can be processed unconsciously and impact people’s cognition and downstream behaviour."
Social Psychology,Verbal framing (temporal tense),Participants who read what a person **was doing** (relative to those who read what person **did**) showed enhanced accessibility of intention-related concepts and attributed more intentionality to the person.
Social Psychology,Reference framing,"* **Reference framing. **Risk preferences change depending on whether a choice is presented in terms of gains or losses, even when the prospects of the options are held constant.​"
Social Psychology,Prosocial spending,Spending money on other people leads to greater happiness than spending money on oneself.
Social Psychology,Gustatory disgust on moral judgement,Gustatory disgust triggers a heightened sense of moral wrongness.
Social Psychology,Macbeth effect,Moral aspersions induce literal physical hygiene.
Social Psychology,Signing at the beginning rather than end makes ethics salient,Signing a statement of honest intent before providing information rather than after can reduce dishonesty.
Social Psychology,Social class on prosocial behaviour,"Individuals from a high social class are more likely to exhibit prosocial behaviour than those from a low social class, but there is a U-shaped curve between social class and prosocial behaviour that sometimes appears."
Social Psychology,Stanford Prison Experiment,"* **Stanford Prison Experiment** employed a simulation of a prison environment to  examine the psychological effects of coercive situations. Utilising role-playing, labelling and social expectations it showed that one third of participants in the role of prison guards displayed aggressive and dehumanising behaviour."
Social Psychology,Milgram experiment,"* **Milgram experiment **was a study examining the influence of authority on immoral behaviour. Participants were assigned the role of ‘teachers’ and they were instructed by the experimentator to administer electric shocks** **of** **15-450 V voltage, whenever the ‘learner’  made a mistake. There were various variants of the study. In the most basic one, 100% of participants agree to administer a 300 V shock and 65% agreed to apply to maximum shock of 450 V."
Social Psychology,Robbers Cave Study,"Utilised arbitrary groupings to demonstrate that tribalism between groups arises spontaneously, and depending on the context, it can result in group competition (e.g., in case of scarce resources) or group cooperation (e.g., in case of superordinate goals and common obstacles)**. **"
Social Psychology,Digital technology use and adolescent wellbeing,* **Digital technology use and adolescent wellbeing. **Adolescents who spend more time on new media (including social media and electronic devices such as smartphones) are more likely to report mental health issues.
Social Psychology,Anthropomorphism,"* **Anthropomorphism. **Individuals who are lonely are more likely than people who are not lonely to attribute humanlike traits (e.g., free will) to nonhuman agents (e.g., an alarm clock),to fulfil unmet needs for belongingness."
Social Psychology,Female-named hurricanes are more deadly than male-named ones,"Original effect size was a 176% increase in deaths, driven entirely by four outliers; reanalysis using a greatly expanded historical dataset found a nonsignificant decrease in deaths from female named storms."
Social Psychology,Implicit bias testing for racism,"Implicit bias scores poorly predict actual bias, _r_ = 0.15. The operationalisations used to measure that predictive power are often unrelated to actual discrimination (e.g. ambiguous brain activations). Test-retest reliability of 0.44 for race, which is usually classed as “unacceptable”. This isn’t news; the original study also found very low test-criterion correlations."
Social Psychology,Pygmalion effect,"* **Pygmalion effect** (Rosenthal Effect, self-fulfilling prophecy). Expectations about performance (e.g., academic achievement) impact performance. Specifically, teachers' expectations about their students’ abilities affect those students’ academic achievement; teacher beliefs impact their behaviour which in turn impacts student beliefs and behaviour."
Social Psychology,Stereotype threat on Asian women’s mathematical performance,"* **Stereotype threat on Asian women’s mathematical performance** (stereotype lift), i.e. the interaction between race, gender and stereotyping. This study found that Asian-American women performed better on a maths test when their ethnic identity was activated, but worse when their gender identity was activated, compared with a control group who had neither identity activated."
Social Psychology,Stereotype threat on girls’ mathematical performance,"* **Stereotype threat on girls’ mathematical performance. **A situational phenomenon whereby priming a negative gender stereotype (e.g., “women are bad at maths”) has a detrimental impact on mathematical performance."
Social Psychology,Increase in narcissism,"* **Increase in narcissism** (leadership, vanity, entitlement) in young people over the last thirty years. It's [an ancient hypothesis.](https://quoteinvestigator.com/2010/05/01/misbehave) The basic counterargument is that they’re misidentifying an age effect as a cohort effect (The narcissism construct [apparently](https://journals.sagepub.com/doi/abs/10.1177/1745691609357019) decreases by about a standard deviation between adolescence and retirement.) “every generation is Generation Me”."
Social Psychology,Minimal group effect (MGE),"* **Minimal group effect** **(MGE)** (Minimal group paradigm). An intergroup bias that manifests as ingroup favouritism (i.e., a tendency to prefer ingroup members) when participants are assigned to previously unfamiliar, experimentally created and largely meaningless social identities. In essence, the paradigm investigates the impact of social categorization on intergroup relations in the absence of realistic conflicts of interests, showing that mere social categorization is sufficient to produce ingroup favouritism."
Social Psychology,Solomon Asch’s conformity,* **Solomon Asch’s conformity study. **The degree to which a person's own opinions are influenced by those of a group.
Social Psychology,Dynamic norms,Information about increasing minority norms increases interest/engagement in minority behaviour.​
Social Psychology,Social comparison,No robust evidence for an interaction effect between body dissatisfaction and social comparison on fat talk.
Social Psychology,Bystander effect,* **Bystander effect:** claims that the feeling of responsibility diffuses with an increasing number of other observers. Research about the bystander effect was sparked by the 1964 murder of Catherine “Kitty” Genovese. See this _[New York Times article](https://www.nytimes.com/1964/03/27/archives/37-who-saw-murder-didnt-call-the-police-apathy-at-stabbing-of.html)_ for details. Here’s a more detailed [resource](http://bps.stanford.edu/?page_id=3671).
Social Psychology,Colour red on attractiveness,Viewing the colour red enhances men's attraction to women. In a lingua franca this effect may reflect the amorous meaning in the human mating game. ​
Social Psychology,Big brother effect,Being watched makes someone more likely to cooperate.
Social Psychology,Imagined Contact - _Bias_,"* **Imagined Contact**. Imagining social contact (instead of having actual contact) with someone from an outgroup (based on e.g., ethnicity, sexuality, religion, age) can reduce intergroup bias."
Social Psychology,Imagined Contact -  _Intentions_,"* **Imagined Contact**. the claim that imagining social contact (instead of having actual contact) with someone from an outgroup (based on e.g., ethnicity, sexuality, religion, age) can increase **contact intentions.**"
Social Psychology,Stereotype susceptibility effects,Awareness of stereotypes about a person’s in-group can affect a person’s behaviour and performance when they complete a stereotype-relevant task.​
Social Psychology,Positive mood-boost helping effect,People are more likely to do good when feeling good.
Social Psychology,Superiority-of-unconscious decision-making effect,"* **Superiority-of-unconscious decision-making effect** (deliberation without attention effect). While conscious reflection produces better choices on simple tasks, complex choices “should be left to unconscious thought”.​"
Social Psychology,Behavioural-consequences-of-automatic-evaluation,"* **Behavioural-consequences-of automatic-evaluation **(affective compatibility effect).** **Automatic classification of stimuli as either good or bad have direct behavioural consequences.​ Automatic evaluation results directly in behavioural predispositions toward the stimulus, such that positive evaluations produce immediate approach tendencies, and negative evaluations produce immediate avoidance tendencies."
Social Psychology,Self-control relies on glucose effect,"* **Self-control relies on glucose effect. **Acts of self-control decrease blood glucose levels; low levels of blood glucose predict poor performance on self-control tasks; initial acts of self-control impair performance on subsequent self-control tasks, but consuming a glucose drink eliminates these impairments.   ** **"
Social Psychology,Physical warmth promotes interpersonal warmth,"Exposure to physical warmth will lead to more positive judgments of strangers and an increase in prosocial behaviour (e.g., gift-giving)."
Social Psychology,Power impairs perspective-taking effect,* **Power impairs perspective-taking effect. **Individuals made to feel high in power were more likely to inaccurately assume that others view the social world from the same perspective as they do.
Social Psychology,Status-legitimacy effect,"Members of low-status, disadvantaged, and marginalised groups are more likely to perceive their social systems as legitimate than their high-status and advantaged counterparts under certain circumstances. People who are most disadvantaged by the status quo, due to the greatest psychological need to reduce ideological dissonance, are most likely to support, defend, and justify existing social systems, authorities, and outcomes.​"
Social Psychology,Red impairs cognitive performance effect,"* **Red impairs cognitive performance**. The colour red impairs performance on achievement tasks, as red is associated with the danger of failure and evokes avoidance motivation."
Social Psychology,Reduced prosociality of high SES effect,Higher socioeconomic status predicts decreased prosocial behaviour. Affluence may be linked with reduced empathy and poverty may be linked with increased empathy.
Social Psychology,Moral licensing effect,"* **Moral licensing effect (**self-licensing, moral self-licensing, licensing effect) is the effect that acting in a moral way makes people more likely to excuse and perform subsequent immoral, unethical, or otherwise problematic behaviours."
Social Psychology,Colour on approach/avoidance,"Red (versus blue) colour induces primarily an avoidance (versus approach) motivation and enhances performance on a detail-oriented task, whereas blue enhances performance on a creative task.​"
Social Psychology,Playboy effect,* **Playboy Effect.** Men exposed to erotic images of the opposite-sex will report lower ratings of love for their partner and lower ratings for their partners sexual attractiveness compared to men exposed to abstract art. This effect was not found in women in either the original or replication attempts.
Social Psychology,Self-protective subjective temporal distance effect,"* **Self-protective subjective temporal distance effect. **Participants reported that negative events in their own lives felt farther away than positive events in their own lives, and this effect was stronger for participants higher in self-esteem."
Social Psychology,Trait loneliness hot shower effect,"People self-regulate their feelings of social warmth (connectedness to others) through applications of physical warmth of shower or bath, without explicit awareness of this substitution. Loneliness as a form of “social coldness” can be relieved by applying physical warmth."
Social Psychology,American flag priming boosts Republican support,"* **American flag priming boosts Republican support. **Subtle exposure to the American flag causes people to report more conservative, Republican beliefs and attitudes."
Social Psychology,Unethicality darkens perception of light,"* **Unethicality darkens perception of light **(El Greco fallacy). Recalling abstract concepts such as evil (as exemplified by unethical deeds) and goodness (as exemplified by ethical deeds) can influence the sensory experience of the brightness of light. Recalling unethical behaviour led participants to see the room as darker and to desire more light-emitting products (e.g., a flashlight) compared to recalling ethical behaviour."
Social Psychology,Fertility on voting,"* **Fertility on voting **(Ovulation effect). Ovulatory (or high-fertility) phase of the menstrual cycle affects voting preferences and has different effects on women who are single then women who are in committed relationships. Single women were more likely to vote for Barack Obama (liberal/Democrat candidate) if they were ovulating then if they were not, while the opposite was true for women in committed relationship – ovulation led them more likely to vote for Mitt Romney (conservative/Republican candidate).​"
Social Psychology,Modulation of 1/f noise on the weapon identification task,Making an effort to modulate the use of racial information decreases the emission of 1/f noise.
Social Psychology,Time is money effect,Putting a price on time can influence enjoyment of leisure activities as individuals get more impatient if they are compensated for engaging in these activities. ​
Social Psychology,Embodiment of secrets,"* **Embodiment of secrets** (secrets-as-burdens). Secrets are experienced as physical burdens, influencing how people perceive and act in the world.​ People who recalled, were preoccupied with, or suppressed an important secret estimated hills to be steeper and perceived distances to be farther."
Social Psychology,Warmer-hearts-warmer-room effect,* **Warmer-hearts-warmer-room effect. **Priming “warm” communal traits (vs. other traits) led participants to report that the room in which they were taking the study was warmer.
Social Psychology,Treating-prejudice-with-imagery effect,Imagining a positive encounter with a member of a stigmatised group promote positive perceptions when it was preceded by imagined negative encounter.​
Social Psychology,Grammar influences perceived intentionality effect,* **Grammar influences perceived intentionality**. Describing a person's behaviours in terms of what the person _was doing _(rather than what the person _did_) enhances intentionality attributions in the context of both mundane and criminal behaviors.​ Participants judged actions described in the imperfective as being more intentional and they imagined these actions in more detail.
Social Psychology,Attachment-warmth embodiment effect,* **Attachment-warmth embodiment effect** (anxious attachment warm food effect) Attachment anxiety positively predicts sensitivity to temperature cues.​ Individuals with high (but not low) attachment anxiety report higher desires for warm foods (but not neutral foods) when attachment is activated.
Social Psychology,Superstition boosts performance effect,"The irrational belief that certain objects (e.g., lucky charms) or beliefs (e.g., religion) will benefit performance in a task.​"
Social Psychology,Social and personal power,"Social power (power over other people) and personal power (freedom from other people) have opposite associations with independence and interdependence; they have opposite effects on stereotyping (social power decreases and personal power increases stereotyping), but parallel effects on behavioural approach (both types of power increase it)."
Social Psychology,Classical anchoring effect,* **Classical anchoring effect** (anchoring and adjustment). Assimilation of numeric estimates toward previously considered numeric values. ​
Social Psychology,Incidental environmental anchoring effect,"* **Incidental Environmental Anchoring** (incidental anchoring [[Critcher & Gilovich, 2008]](https://doi.org/10.1002/bdm.586), basic anchoring [[Wilson, Houston, Etling, & Brekke, 1996]](https://doi.org/10.1037//0096-3445.125.4.387) “Anchor values that are incidentally present in the environment can affect a person’s numerical estimates (...) these effects were not qualified by participants’ expertise in the relevant domain (study 1) or by their ability to subsequently recall the anchor value (study 3).” (Critcher & Gilovich, 2008)."
Social Psychology,Subliminal anchoring effect,"* **Subliminal anchoring effect** (subliminal anchoring). Numeric estimates are biassed toward previously, subliminally presented numbers that could not be perceived by respondents.​"
Social Psychology,Facial Colours and perceived emotions,"* **Facial redness increased perceived anger.** When people rate faces and these are red, rated anger is positively associated with the faces’ redness.​"
Social Psychology,Romeo and Juliet effect,"* **Romeo and Juliet effect. **Greater love and commitment towards a romantic partner when others (e.g., parents, friends) are observed to interfere with, or disapprove of, the relationship.​"
Social Psychology,Stereotype activation effect,Judgments of targets that follow gender-congruent primes are made faster than judgments of targets that follow gender-incongruent primes.​
Social Psychology,Sex difference in distress to infidelity,"Men, compared to women, are more distressed by sexual than emotional infidelity, and this sex difference continued into older age.​"
Social Psychology,Content effect for cheater detection,* **Content effect for cheater detection. **There is a performance improvement on the Wason selection task if it involves cheater detection. College students were better able to complete the selection task for unfamiliar scenarios if it involved detecting a cheater instead of a descriptive scenario.
Social Psychology,Dissenting deviant social rejection effect,Groups reject opinion deviates from future interaction.
Social Psychology,Sex differences in implicit maths attitudes,"College students, especially women, demonstrated negativity toward maths and science relative to arts and language on implicit measures.​"
Social Psychology,Low versus high category scale effect on behaviour self – report,"* **Low versus high category scale effect on behaviour self-report**. Response scales serve informative functions. The response categories suggest a range of ""usual"" or ""expected"" behaviours, and this information affects respondents' behavioural reports as well as related judgments."
Social Psychology,Information source on attitudes effect,The source of information has a major impact on how that information is perceived and evaluated.
Social Psychology,Door-in-the-face effect,* **Door-in-the-face effect.** The door-in-the-face effect occurs when making a larger initial request and then afterwards scaling back and asking a more moderate request increases compliance (with the moderate request) compared to either starting with the moderate request or starting with a small request.
Social Psychology,Foot-in-the-door effect,* **Foot-in-the-door effect. **The foot-in-the-door effect occurs when getting people to comply with a very small initial request increases the likelihood that they will agree to a larger request (compared to starting with the larger request).
Social Psychology,Ingroup-outgroup norm of reciprocity effect,"“When confronted with a decision about allowing or denying the same behaviour to an ingroup and outgroup, people may feel an obligation to reciprocity, or consistency in their evaluation of the behaviours.”"
Social Psychology,Social dominance-status,"* **Social dominance-status **(verticality effects). Vertical dimension of human relations (such as dominance and submission) and nonverbal behaviour are intimately and fruitfully linked; nonverbal behaviour, such as gazing, smiling, touching, and various body positions can signal high and low verticality."
