title,year,authors,authors_string,doi,url,publication,pages,volume,issue,citation_count_CR,citation_count_entered,parsed,citations,citation,reference,use,publication_id,entry
"Registered Replication Report.Study 1 From Finkel, Rusbult, Kumashiro, &amp; Hannon (2002)",2016,,"Cheung, I. and Campbell, L. and LeBel, E. P. and Ackerman, R. A. and Aykutoğlu, B. and Bahník, Š. and Bowen, J. D. and Bredow, C. A. and Bromberg, C. and Caprariello, P. A. and Carcedo, R. J. and Carson, K. J. and Cobb, R. J. and Collins, N. L. and Corretti, C. A. and DiDonato, T. E. and Ellithorpe, C. and Fernández-Rouco, N. and Fuglestad, P. T. and Goldberg, R. M. and Golom, F. D. and Gündoğdu-Aktürk, E. and Hoplock, L. B. and Houdek, P. and Kane, H. S. and Kim, J. S. and Kraus, S. and Leone, C. T. and Li, N. P. and Logan, J. M. and Millman, R. D. and Morry, M. M. and Pink, J. C. and Ritchey, T. and Root Luna, L. M. and Sinclair, H. C. and Stinson, D. A. and Sucharyna, T. A. and Tidwell, N. D. and Uysal, A. and Vranka, M. and Winczewski, L. A. and Yong, J. C.",10.1177/1745691616664694,http://dx.doi.org/10.1177/1745691616664694,Perspectives on Psychological Science,750-764,11,5,29,NA,NA,NA,Cheung et al. (2016),"Cheung, I., Campbell, L., LeBel, E. P., Ackerman, R. A., Aykutoğlu, B., Bahník, Š., Bowen, J. D., Bredow, C. A., Bromberg, C., Caprariello, P. A., Carcedo, R. J., Carson, K. J., Cobb, R. J., Collins, N. L., Corretti, C. A., DiDonato, T. E., Ellithorpe, C., Fernández-Rouco, N., Fuglestad, P. T., Goldberg, R. M., Golom, F. D., Gündoğdu-Aktürk, E., Hoplock, L. B., Houdek, P., Kane, H. S., Kim, J. S., Kraus, S., Leone, C. T., Li, N. P., Logan, J. M., Millman, R. D., Morry, M. M., Pink, J. C., Ritchey, T., Root Luna, L. M., Sinclair, H. C., Stinson, D. A., Sucharyna, T. A., Tidwell, N. D., Uysal, A., Vranka, M., Winczewski, L. A., Yong, J. C. (2016). Registered Replication Report.Study 1 From Finkel, Rusbult, Kumashiro, &amp; Hannon (2002). Perspectives On Psychological Science, 11(5). https://doi.org/10.1177/1745691616664694",replication,33,"[Cheung et al. 2016](https://journals.sagepub.com/doi/pdf/10.1177/1745691616664694) [n = 2284, citations = 110(GS, November 2021)]."
Knowing Who You Are and Adding to It.Reduced Self-Concept Clarity Predicts Reduced Self-Expansion,2014,,"Emery, Lydia F. and Walsh, Courtney and Slotter, Erica B.",10.1177/1948550614555029,http://dx.doi.org/10.1177/1948550614555029,Social Psychological and Personality Science,259-266,6,3,36,NA,NA,NA,Emery et al. (2014),"Emery, L. F., Walsh, C., Slotter, E. B. (2014). Knowing Who You Are and Adding to It.Reduced Self-Concept Clarity Predicts Reduced Self-Expansion. Social Psychological And Personality Science, 6(3). https://doi.org/10.1177/1948550614555029",original,34,"‘[Knowing who you are and adding to it: Reduced self-concept clarity predicts reduced self-expansion](https://doi.org/10.1177/1948550614555029)’, Emery et al. (2015) Study 3 with n=152. [citation=54(GS, November 2021)]​."
Stuck in Time: Negative Income Shock Constricts the Temporal Window of Valuation Spanning the Future and the Past.,2016,,"Bickel, Warren K. and Wilson, A. George and Chen, Chen and Koffarnus, Mikhail N. and Franck, Christopher T.",10.1371/journal.pone.0163051,http://dx.doi.org/10.1371/journal.pone.0163051,PLOS ONE,e0163051,11,9,35,NA,NA,NA,Bickel et al. (2016),"Bickel, W. K., Wilson, A. G., Chen, C., Koffarnus, M. N., Franck, C. T. (2016). Stuck in Time: Negative Income Shock Constricts the Temporal Window of Valuation Spanning the Future and the Past.. Plos One, 11(9). https://doi.org/10.1371/journal.pone.0163051",original,35,"‘[Stuck in time: Negative income shock constricts the temporal window of valuation spanning the future and the past](https://doi.org/10.1371/journal.pone.0163051)’, Bickel et al. (2016) with n=401. [citation=51(GS, November 2021)]​."
Scarcity Polarizes Preferences: The Impact on Choice among Multiple Items in a Product Class.,2015,,"Zhu, Meng and Ratner, Rebecca K.",10.1509/jmr.13.0451,http://dx.doi.org/10.1509/jmr.13.0451,Journal of Marketing Research,13-26,52,1,70,NA,NA,NA,Zhu & Ratner (2015),"Zhu, M., Ratner, R. K. (2015). Scarcity Polarizes Preferences: The Impact on Choice among Multiple Items in a Product Class.. Journal Of Marketing Research, 52(1). https://doi.org/10.1509/jmr.13.0451",original,36,"‘[Scarcity polarizes preferences: The impact on choice among multiple items in a product class](https://doi.org/10.1509/jmr.13.0451)’, Zhu and Ratner (2015) with n=200. [citation=114(GS, November 2021)]​."
Effects of Perceived Scarcity on Financial Decision Making.,2018,,"Cook, Laurel Aynne and Sadeghein, Raika",10.1509/jppm.16.157,http://dx.doi.org/10.1509/jppm.16.157,Journal of Public Policy &amp; Marketing,68-87,37,1,22,NA,NA,NA,Cook & Sadeghein (2018),"Cook, L. A., Sadeghein, R. (2018). Effects of Perceived Scarcity on Financial Decision Making.. Journal Of Public Policy &Amp; Marketing, 37(1). https://doi.org/10.1509/jppm.16.157",original,37,"‘[Effects of perceived scarcity on financial decision making](https://doi.org/10.1509/jppm.16.157)’, Cook and Sadeghein (2018); with n=199. [citation=26(GS, November 2021)]​."
Money in the Mental Lives of the Poor.,2018,,"Shah, Anuj K. and Zhao, Jiaying and Mullainathan, Sendhil and Shafir, Eldar",10.1521/soco.2018.36.1.4,http://dx.doi.org/10.1521/soco.2018.36.1.4,Social Cognition,4-19,36,1,66,NA,NA,NA,Shah et al. (2018),"Shah, A. K., Zhao, J., Mullainathan, S., Shafir, E. (2018). Money in the Mental Lives of the Poor.. Social Cognition, 36(1). https://doi.org/10.1521/soco.2018.36.1.4",original,38,"‘[Money in the mental lives of the poor](https://doi.org/10.1521/soco.2018.36.1.4)’, Shah et al. (2018) with n=568. [citation=78(GS, November 2021)]​."
Distractibility in Daily Life Is Reflected in the Structure and Function of Human Parietal Cortex.,2011,,"Kanai, Ryota and Dong, Mia Yuan and Bahrami, Bahador and Rees, Geraint",10.1523/JNEUROSCI.5864-10.2011,http://dx.doi.org/10.1523/JNEUROSCI.5864-10.2011,The Journal of Neuroscience,6620-6626,31,18,73,NA,NA,NA,"Kanai, Dong et al. (2011)","Kanai, R., Dong, M. Y., Bahrami, B., Rees, G. (2011). Distractibility in Daily Life Is Reflected in the Structure and Function of Human Parietal Cortex.. The Journal Of Neuroscience, 31(18). https://doi.org/10.1523/JNEUROSCI.5864-10.2011",original,39,"[Kanai et al., (2011)](https://doi.org/10.1523/JNEUROSCI.5864-10.2011) [n = 155, citations: 110 (GS, May, 2022)]."
Do Incidental Environmental Anchors Bias Consumers’ Price Estimations?.,2020,,"Shanks, David R. and Barbieri-Hermitte, Pietro and Vadillo, Miguel A.",10.1525/collabra.310,http://dx.doi.org/10.1525/collabra.310,Collabra: Psychology,NA,6,1,4,NA,NA,NA,Shanks et al. (2020),"Shanks, D. R., Barbieri-Hermitte, P., Vadillo, M. A. (2020). Do Incidental Environmental Anchors Bias Consumers’ Price Estimations?.. Collabra: Psychology, 6(1). https://doi.org/10.1525/collabra.310",replication,40,"[Shanks, Barbieri-Hermitte, & Vadillo, 2020](https://doi.org/10.1525/collabra.310) [n(Restaurant item)= 69 (Study 1) + 125 (Study 2) + 422 (Study 3) = 616, citations=11(Google Scholar, August, 2022)]."
NA,NA,,NA,NA,NA,NA,NA,NA,NA,NA,NA,FALSE,"citations = ~ 1108(GS, November 2021)",NA (NAa),"NA, NA. (NA). NA. . ",original,41,"‘[Dealing with betrayal in close relationships: Does commitment promote forgiveness?](https://faculty.wcas.northwestern.edu/eli-finkel/documents/Finkeletal_2002_000.pdf)’, Finkel et al. 2002; 3 experiments with Study 1: n = 89; Study 2: n = 155; Study 3: n = 78. [citations = ~ 1108(GS, November 2021)]."
