title,year,authors,authors_string,doi,url,publication,pages,volume,issue,citation_count_CR,citation_count_entered,parsed,citations,citation,reference,use,publication_id,entry
Evidence for Opportunity Cost Neglect in the Poor.Opportunity Cost Neglect in the Poor,2017,,"Plantinga, Arnoud and Krijnen, Job M.T. and Zeelenberg, Marcel and Breugelmans, Seger M.",10.1002/bdm.2041,http://dx.doi.org/10.1002/bdm.2041,Journal of Behavioral Decision Making,65-73,31,1,10,NA,NA,NA,Plantinga et al. (2017),"Plantinga, A., Krijnen, J. M., Zeelenberg, M., Breugelmans, S. M. (2017). Evidence for Opportunity Cost Neglect in the Poor.Opportunity Cost Neglect in the Poor. Journal Of Behavioral Decision Making, 31(1). https://doi.org/10.1002/bdm.2041",original,1,"‘[Evidence for opportunity cost neglect in the poor](https://doi.org/10.1002/bdm.2041)’, Plantinga et al. (2019) with n=642. [citation=18(GS, November 2021)]​."
Incidental environmental anchors.,2008,,"Critcher, Clayton R. and Gilovich, Thomas",10.1002/bdm.586,http://dx.doi.org/10.1002/bdm.586,Journal of Behavioral Decision Making,241-251,21,3,103,NA,NA,NA,Critcher & Gilovich (2008),"Critcher, C. R., Gilovich, T. (2008). Incidental environmental anchors.. Journal Of Behavioral Decision Making, 21(3). https://doi.org/10.1002/bdm.586",original,2,"‘[Incidental environmental anchors](https://doi.org/10.1002/bdm.586)’, Critcher & Gilovich, 2008; 3 studies w. Between-subjects manipulation of incidental anchors, n = 265 (Study 1) + 207 (Study 2) + 194 (Study 3) = 666. [citations=261(Google Scholar, August 2022)]​."
Did They Earn It? Observing Unearned Luxury Consumption Decreases Brand Attitude When Observers Value Fairness.,2018,,"Lee, Saerom and Baumgartner, Hans and Winterich, Karen Page",10.1002/jcpy.1028,http://dx.doi.org/10.1002/jcpy.1028,Journal of Consumer Psychology,412-436,28,3,21,NA,NA,NA,Lee et al. (2018),"Lee, S., Baumgartner, H., Winterich, K. P. (2018). Did They Earn It? Observing Unearned Luxury Consumption Decreases Brand Attitude When Observers Value Fairness.. Journal Of Consumer Psychology, 28(3). https://doi.org/10.1002/jcpy.1028",original,3,"‘[Did they earn it? Observing unearned luxury consumption decreases brand attitude when observers value fairness](https://doi.org/10.1002/jcpy.1028)’, Lee et al. (2018) with n=164. [citation=23(GS, November 2021)]​."
A purely confirmatory replication study of structural brain-behavior correlations.,2015,,"Boekel, Wouter and Wagenmakers, Eric-Jan and Belay, Luam and Verhagen, Josine and Brown, Scott and Forstmann, Birte U.",10.1016/j.cortex.2014.11.019,http://dx.doi.org/10.1016/j.cortex.2014.11.019,Cortex,115-133,66,"2015, 5",121,NA,NA,NA,Boekel et al. (2015a),"Boekel, W., Wagenmakers, E., Belay, L., Verhagen, J., Brown, S., Forstmann, B. U. (2015). A purely confirmatory replication study of structural brain-behavior correlations.. Cortex, 66(2015, 5). https://doi.org/10.1016/j.cortex.2014.11.019",replication,4,"[Boekel et al. (2015)](https://doi.org/10.1016/j.cortex.2014.11.019) [n = 36, citations = 196 (GS, May, 2022]."
Using implicit goal priming to improve the quality of self-report data.,2005,,"Rasinski, Kenneth A. and Visser, Penny S. and Zagatsky, Maria and Rickett, Edith M.",10.1016/j.jesp.2004.07.001,http://dx.doi.org/10.1016/j.jesp.2004.07.001,Journal of Experimental Social Psychology,321-327,41,3,35,"citations = 111 (Google Scholar, October 2022)",NA,NA,Rasinski et al. (2005),"Rasinski, K. A., Visser, P. S., Zagatsky, M., Rickett, E. M. (2005). Using implicit goal priming to improve the quality of self-report data.. Journal Of Experimental Social Psychology, 41(3). https://doi.org/10.1016/j.jesp.2004.07.001",original,5,"‘Using implicit goal priming to improve the quality of self-report data’,[ Rasinski et al. (2005)](https://doi.org/10.1016/j.jesp.2004.07.001), between-subjects, _n_ = 64 [citations = 111 (Google Scholar, October 2022)]."
Cortico-striatal connections predict control over speed and accuracy in perceptual decision making.,2010,,"Forstmann, Birte U. and Anwander, Alfred and Schäfer, Andreas and Neumann, Jane and Brown, Scott and Wagenmakers, Eric-Jan and Bogacz, Rafal and Turner, Robert",10.1073/pnas.1004932107,http://dx.doi.org/10.1073/pnas.1004932107,Proceedings of the National Academy of Sciences,15916-15920,107,36,268,NA,NA,NA,Forstmann et al. (2010),"Forstmann, B. U., Anwander, A., Schäfer, A., Neumann, J., Brown, S., Wagenmakers, E., Bogacz, R., Turner, R. (2010). Cortico-striatal connections predict control over speed and accuracy in perceptual decision making.. Proceedings Of The National Academy Of Sciences, 107(36). https://doi.org/10.1073/pnas.1004932107",original,6,"[Forstmann et al. (2010) [](https://doi.org/10.1073/pnas.1004932107)n = 9, citations = 387 (GS, May 2022)]​."
Signing at the beginning makes ethics salient and decreases dishonest self-reports in comparison to signing at the end.,2012,,"Shu, Lisa L. and Mazar, Nina and Gino, Francesca and Ariely, Dan and Bazerman, Max H.",10.1073/pnas.1209746109,http://dx.doi.org/10.1073/pnas.1209746109,Proceedings of the National Academy of Sciences,15197-15200,109,38,230,"citations=482 (GS, June 2022)",NA,NA,Shu et al. (2012),"Shu, L. L., Mazar, N., Gino, F., Ariely, D., Bazerman, M. H. (2012). Signing at the beginning makes ethics salient and decreases dishonest self-reports in comparison to signing at the end.. Proceedings Of The National Academy Of Sciences, 109(38). https://doi.org/10.1073/pnas.1209746109",original,7,"‘[Signing at the beginning makes ethics salient and decreases dishonest self-reports in comparison to signing at the end](https://www.pnas.org/doi/full/10.1073/pnas.1209746109)’, Shu, Mazar, Gino, Ariely, and Bazerman 2012 (Retracted 09/2021); 3 experiments with study n’s 1: 101; 2: 60; 3: 13,488. [citations=482 (GS, June 2022)]"
Empirical audit and review and an assessment of evidentiary value in research on the psychological consequences of scarcity.,2021,,"O’Donnell, Michael and Dev, Amelia S. and Antonoplis, Stephen and Baum, Stephen M. and Benedetti, Arianna H. and Brown, N. Derek and Carrillo, Belinda and Choi, Andrew L. and Connor, Paul and Donnelly, Kristin and Ellwood-Lowe, Monica E. and Foushee, Ruthe and Jansen, Rachel and Jarvis, Shoshana N. and Lundell-Creagh, Ryan and Ocampo, Joseph M. and Okafor, Gold N. and Azad, Zahra Rahmani and Rosenblum, Michael and Schatz, Derek and Stein, Daniel H. and Wang, Yilu and Moore, Don A. and Nelson, Leif D.",10.1073/pnas.2103313118,http://dx.doi.org/10.1073/pnas.2103313118,Proceedings of the National Academy of Sciences,NA,118,44,8,NA,NA,NA,O’Donnell et al. (2021a),"O’Donnell, M., Dev, A. S., Antonoplis, S., Baum, S. M., Benedetti, A. H., Brown, N. D., Carrillo, B., Choi, A. L., Connor, P., Donnelly, K., Ellwood-Lowe, M. E., Foushee, R., Jansen, R., Jarvis, S. N., Lundell-Creagh, R., Ocampo, J. M., Okafor, G. N., Azad, Z. R., Rosenblum, M., Schatz, D., Stein, D. H., Wang, Y., Moore, D. A., Nelson, L. D. (2021). Empirical audit and review and an assessment of evidentiary value in research on the psychological consequences of scarcity.. Proceedings Of The National Academy Of Sciences, 118(44). https://doi.org/10.1073/pnas.2103313118",replication,8,"[O’Donnell et al. 2021](https://doi.org/10.1073/pnas.2103313118) [n=304, citations=0(GS, November 2021)]."
The existential cost of economic insecurity: Threatened financial security undercuts meaning.,2016,,"Abeyta, Andrew A. and Routledge, Clay and Kersten, Michael and Cox, Cathy R.",10.1080/00224545.2016.1270892,http://dx.doi.org/10.1080/00224545.2016.1270892,The Journal of Social Psychology,692-702,157,6,9,NA,NA,NA,Abeyta et al. (2016),"Abeyta, A. A., Routledge, C., Kersten, M., Cox, C. R. (2016). The existential cost of economic insecurity: Threatened financial security undercuts meaning.. The Journal Of Social Psychology, 157(6). https://doi.org/10.1080/00224545.2016.1270892",original,9,"‘[The existential cost of economic insecurity: Threatened financial security undercuts meaning](https://doi.org/10.1080/00224545.2016.1270892)’, Abeyta et al. (2017) with n=121. [citations=8(GS, November 2021)]​."
Handedness as a major determinant of functional cradling bias.,2006,,"van der Meer, Audrey and Husby, Åsmund",10.1080/13576500500513565,http://dx.doi.org/10.1080/13576500500513565,"Laterality: Asymmetries of Body, Brain and Cognition",263-276,11,3,44,NA,NA,NA,van der Meer & Husby (2006),"van der Meer, A., Husby, Å. (2006). Handedness as a major determinant of functional cradling bias.. Laterality: Asymmetries Of Body, Brain And Cognition, 11(3). https://doi.org/10.1080/13576500500513565",original,10,"Handedness as a major determinant of functional cradling bias, [van de Meer & Husby (2007)](https://www.tandfonline.com/doi/full/10.1080/13576500500513565?casa_token=JmBY4cKhwcUAAAAA%3AEiko-Fy4woaiDdV_N7INojc6nRquY37yHHonu2673DSBKMd5gG0pdq8_J-TOnkgjKuXcQp7nRD1ccrY), laboratory study in which 765 left- and right-handers were asked to cradle a baby doll. Side of holding was recorded in the studies [citations = 67(GS, June 2022)]​."
Reframing the ordinary: Imagining time as scarce increases well-being.,2017,,"Layous, Kristin and Kurtz, Jaime and Chancellor, Joseph and Lyubomirsky, Sonja",10.1080/17439760.2017.1279210,http://dx.doi.org/10.1080/17439760.2017.1279210,The Journal of Positive Psychology,301-308,13,3,7,NA,NA,NA,Layous et al. (2017),"Layous, K., Kurtz, J., Chancellor, J., Lyubomirsky, S. (2017). Reframing the ordinary: Imagining time as scarce increases well-being.. The Journal Of Positive Psychology, 13(3). https://doi.org/10.1080/17439760.2017.1279210",original,11,"‘[Reframing the ordinary: Imagining time as scarce increases well-being](https://doi.org/10.1080/17439760.2017.1279210)’, Layous et al. (2018) with n=111. [citation=22(GS, November 2021)]​."
Squeezed: Coping with Constraint through Efficiency and Prioritization.,2015,,"Fernbach, Philip M. and Kan, Christina and Lynch, John G.",10.1086/679118,http://dx.doi.org/10.1086/679118,Journal of Consumer Research,1204-1227,41,5,64,NA,NA,NA,Fernbach et al. (2015),"Fernbach, P. M., Kan, C., Lynch, J. G. (2015). Squeezed: Coping with Constraint through Efficiency and Prioritization.. Journal Of Consumer Research, 41(5). https://doi.org/10.1086/679118",original,12,"‘[Squeezed: Coping with constraint through efficiency and prioritization](https://doi.org/10.1086/679118)’, Fernbach et al. (2015) with n=102. [citation=114(GS, November 2021)]​."
Associations between Regional Cortical Thickness and Attentional Networks as Measured by the Attention Network Test.,2010,,"Westlye, Lars T. and Grydeland, Håkon and Walhovd, Kristine B. and Fjell, Anders M.",10.1093/cercor/bhq101,http://dx.doi.org/10.1093/cercor/bhq101,Cerebral Cortex,345-356,21,2,121,NA,NA,NA,Westlye et al. (2010),"Westlye, L. T., Grydeland, H., Walhovd, K. B., Fjell, A. M. (2010). Associations between Regional Cortical Thickness and Attentional Networks as Measured by the Attention Network Test.. Cerebral Cortex, 21(2). https://doi.org/10.1093/cercor/bhq101",original,13,"[ Westlye et al., (2011)](https://doi.org/10.1093/cercor/bhq101) [n = 132; citations = 190 (GS, May 2022)]​."
Seeking Lasting Enjoyment with Limited Money: Financial Constraints Increase Preference for Material Goods over Experiences.,2015,,"Tully, Stephanie M. and Hershfield, Hal E. and Meyvis, Tom",10.1093/jcr/ucv007,http://dx.doi.org/10.1093/jcr/ucv007,Journal of Consumer Research,59-75,42,1,93,NA,NA,NA,Tully et al. (2015),"Tully, S. M., Hershfield, H. E., Meyvis, T. (2015). Seeking Lasting Enjoyment with Limited Money: Financial Constraints Increase Preference for Material Goods over Experiences.. Journal Of Consumer Research, 42(1). https://doi.org/10.1093/jcr/ucv007",original,14,"‘[Seeking lasting enjoyment with limited money: Financial constraints increase preference for material goods over experiences](https://doi.org/10.1093/jcr/ucv007)’, Tully et al. (2015) with n=377. [citation=116(GS, November 2021)]."
Spending on Daughters versus Sons in Economic Recessions.,2015,,"Durante, Kristina M. and Griskevicius, Vladas and Redden, Joseph P. and Edward White, Andrew",10.1093/jcr/ucv023,http://dx.doi.org/10.1093/jcr/ucv023,Journal of Consumer Research,435-457,42,3,40,NA,NA,NA,Durante et al. (2015),"Durante, K. M., Griskevicius, V., Redden, J. P., Edward White, A. (2015). Spending on Daughters versus Sons in Economic Recessions.. Journal Of Consumer Research, 42(3). https://doi.org/10.1093/jcr/ucv023",original,15,"‘[Spending on daughters versus sons in economic recessions](https://doi.org/10.1093/jcr/ucv023)’, Durante et al. (2015) with n=198. [citation=57(GS, November 2021)]​."
On the Psychology of Scarcity: When Reminders of Resource Scarcity Promote Selfish (and Generous) Behavior.,2015,,"Roux, Caroline and Goldsmith, Kelly and Bonezzi, Andrea",10.1093/jcr/ucv048,http://dx.doi.org/10.1093/jcr/ucv048,Journal of Consumer Research,ucv048,NA,"2015, 9, 10",37,NA,NA,NA,Roux et al. (2015),"Roux, C., Goldsmith, K., Bonezzi, A. (2015). On the Psychology of Scarcity: When Reminders of Resource Scarcity Promote Selfish (and Generous) Behavior.. Journal Of Consumer Research(2015, 9, 10). https://doi.org/10.1093/jcr/ucv048",original,16,"‘[On the psychology of scarcity: When reminders of resource scarcity promote selfish (and generous) behavior](https://doi.org/10.1093/jcr/ucv048)’, Roux et al. (2015) with n=157. [citation=216(GS, November 2021)]​."
Creating When You Have Less: The Impact of Resource Scarcity on Product Use Creativity.,2015,,"Mehta, Ravi and Zhu, Meng",10.1093/jcr/ucv051,http://dx.doi.org/10.1093/jcr/ucv051,Journal of Consumer Research,767-782,42,5,81,NA,NA,NA,Mehta & Zhu (2015),"Mehta, R., Zhu, M. (2015). Creating When You Have Less: The Impact of Resource Scarcity on Product Use Creativity.. Journal Of Consumer Research, 42(5). https://doi.org/10.1093/jcr/ucv051",original,17,"‘[Creating when you have less: The impact of resource scarcity on product use creativity](https://doi.org/10.1093/jcr/ucv051)’, Mehta and Zhu (2016) with n=88. [citation=135(GS, November 2021)]​."
The Dark Side of Scarcity Promotions: How Exposure to Limited-Quantity Promotions Can Induce Aggression.,2016,,"Kristofferson, Kirk and McFerran, Brent and Morales, Andrea C. and Dahl, Darren W.",10.1093/jcr/ucw056,http://dx.doi.org/10.1093/jcr/ucw056,Journal of Consumer Research,ucw056,NA,"2016, 9, 28",15,NA,NA,NA,Kristofferson et al. (2016),"Kristofferson, K., McFerran, B., Morales, A. C., Dahl, D. W. (2016). The Dark Side of Scarcity Promotions: How Exposure to Limited-Quantity Promotions Can Induce Aggression.. Journal Of Consumer Research(2016, 9, 28). https://doi.org/10.1093/jcr/ucw056",original,18,"‘[The dark side of scarcity promotions: how exposure to limited-quantity promotions can induce aggression](https://doi.org/10.1093/jcr/ucw056)’, Kristofferson et al. (2017) with n=160. [citation=101(GS, November 2021)]​."
Eliciting Time versus Money: Time Scarcity Underlies Asymmetric Wage Rates.,2017,,"Monga, Ashwani and May, Frank and Bagchi, Rajesh",10.1093/jcr/ucx066,http://dx.doi.org/10.1093/jcr/ucx066,Journal of Consumer Research,833-852,44,4,14,NA,NA,NA,Monga et al. (2017),"Monga, A., May, F., Bagchi, R. (2017). Eliciting Time versus Money: Time Scarcity Underlies Asymmetric Wage Rates.. Journal Of Consumer Research, 44(4). https://doi.org/10.1093/jcr/ucx066",original,19,"‘[Eliciting time versus money: time scarcity underlies asymmetric wage rates](https://doi.org/10.1093/jcr/ucx066)’, Monga et al. (2017) with n=179. [citation=27(GS, November 2021)]​."
Online social network size is reflected in human brain structure.,2011,,"Kanai, R. and Bahrami, B. and Roylance, R. and Rees, G.",10.1098/rspb.2011.1959,http://dx.doi.org/10.1098/rspb.2011.1959,Proceedings of the Royal Society B: Biological Sciences,1327-1334,279,1732,194,NA,NA,NA,"Kanai, Bahrami et al. (2011)","Kanai, R., Bahrami, B., Roylance, R., Rees, G. (2011). Online social network size is reflected in human brain structure.. Proceedings Of The Royal Society B: Biological Sciences, 279(1732). https://doi.org/10.1098/rspb.2011.1959",original,20,"[Kanai et al., (2012)](https://doi.org/10.1098/rspb.2011.1959) [n = 125, citations: 411 (GS, May, 2022)]."
Stereotype Susceptibility: Identity Salience and Shifts in Quantitative Performance.,1999,,"Shih, Margaret and Pittinsky, Todd L. and Ambady, Nalini",10.1111/1467-9280.00111,http://dx.doi.org/10.1111/1467-9280.00111,Psychological Science,80-83,10,1,740,NA,NA,NA,Shih et al. (1999),"Shih, M., Pittinsky, T. L., Ambady, N. (1999). Stereotype Susceptibility: Identity Salience and Shifts in Quantitative Performance.. Psychological Science, 10(1). https://doi.org/10.1111/1467-9280.00111",original,21,"[‘Domain-specific Effects of Stereotypes on Performance’](https://journals.sagepub.com/doi/10.1111/1467-9280.00111), Shih et al.1999"
Effort for Payment.A Tale of Two Markets,2004,,"Heyman, James and Ariely, Dan",10.1111/j.0956-7976.2004.00757.x,http://dx.doi.org/10.1111/j.0956-7976.2004.00757.x,Psychological Science,787-793,15,11,537,NA,NA,NA,Heyman & Ariely (2004),"Heyman, J., Ariely, D. (2004). Effort for Payment.A Tale of Two Markets. Psychological Science, 15(11). https://doi.org/10.1111/j.0956-7976.2004.00757.x",original,22,"[‘Effort for Payment: A Tale of Two Markets’](https://doi.org/10.1111/j.0956-7976.2004.00757.x), Heyman and Ariely (2004); sample size = 614 (Experiment 1). [citations=1261(Google Scholar, June 2022)]​"
God Is Watching You.Priming God Concepts Increases Prosocial Behavior in an Anonymous Economic Game,2007,,"Shariff, Azim F. and Norenzayan, Ara",10.1111/j.1467-9280.2007.01983.x,http://dx.doi.org/10.1111/j.1467-9280.2007.01983.x,Psychological Science,803-809,18,9,668,"citations=1473, GS, November 2021",NA,NA,Shariff & Norenzayan (2007),"Shariff, A. F., Norenzayan, A. (2007). God Is Watching You.Priming God Concepts Increases Prosocial Behavior in an Anonymous Economic Game. Psychological Science, 18(9). https://doi.org/10.1111/j.1467-9280.2007.01983.x",original,23,"‘[God is watching you: Priming god concepts increases prosocial behavior in an anonymous economic game](https://journals.sagepub.com/doi/abs/10.1111/j.1467-9280.2007.01983.x)’, Shariff and Norenzayan (2007); 2 experiments, ns=50 in each experiment [citations=1473, GS, November 2021]."
"Creating Social Connection Through Inferential Reproduction.Loneliness and Perceived Agency in Gadgets, Gods, and Greyhounds",2008,,"Epley, Nicholas and Akalis, Scott and Waytz, Adam and Cacioppo, John T.",10.1111/j.1467-9280.2008.02056.x,http://dx.doi.org/10.1111/j.1467-9280.2008.02056.x,Psychological Science,114-120,19,2,353,NA,NA,NA,Epley et al. (2008),"Epley, N., Akalis, S., Waytz, A., Cacioppo, J. T. (2008). Creating Social Connection Through Inferential Reproduction.Loneliness and Perceived Agency in Gadgets, Gods, and Greyhounds. Psychological Science, 19(2). https://doi.org/10.1111/j.1467-9280.2008.02056.x",original,24,"[Creating Social Connection Through Inferential Reproduction: Loneliness and Perceived Agency in Gadgets, Gods, and Greyhounds](https://journals.sagepub.com/doi/full/10.1111/j.1467-9280.2008.02056.x?casa_token=wB20P1GmttgAAAAA%3AxfhrS3yxTMyXdT6JCYs-dfwEmcJZ01bNYn_KP3PxW2a2YOQcIfqT6FSAItyLQEFUSBenEvvElA1n) Epley et al. (2008), [n=20 for experiment 1, n=99 for experiment 2, n =57 for experiment 3; ~[722](https://scholar.google.com/scholar?cites=16612236606641696729&as_sdt=2005&sciodt=0,5&hl=en) citations, (GS, March 2022)]"
"Effects of Fluency on Psychological Distance and Mental Construal (or Why New York Is a Large City, but <i>New York</i> Is a Civilized Jungle).",2008,,"Alter, Adam L. and Oppenheimer, Daniel M.",10.1111/j.1467-9280.2008.02062.x,http://dx.doi.org/10.1111/j.1467-9280.2008.02062.x,Psychological Science,161-167,19,2,147,"citations = 304 (GS, October 2021)",NA,NA,Alter & Oppenheimer (2008),"Alter, A. L., Oppenheimer, D. M. (2008). Effects of Fluency on Psychological Distance and Mental Construal (or Why New York Is a Large City, but <i>New York</i> Is a Civilized Jungle).. Psychological Science, 19(2). https://doi.org/10.1111/j.1467-9280.2008.02062.x",original,25,"[Effects of Fluency on Psychological Distance and Mental Construal (or Why New York Is a Large City, but New York Is a Civilized Jungle)](https://journals.sagepub.com/doi/10.1111/j.1467-9280.2008.02062.x) Alter and Oppenheimer 2008; 3 studies, 2 of which are split into Part A and Part B with n’s = 1A: 40 and 1B: 196 ; 2A: 32 and 2B: 230; Experiment 3: 70 [citations = 304 (GS, October 2021)]."
Some Consequences of Having Too Little.,2012,,"Shah, Anuj K. and Mullainathan, Sendhil and Shafir, Eldar",10.1126/science.1222426,http://dx.doi.org/10.1126/science.1222426,Science,682-685,338,6107,718,"citations=1403 (GS, April 2022)",NA,NA,Shah et al. (2012),"Shah, A. K., Mullainathan, S., Shafir, E. (2012). Some Consequences of Having Too Little.. Science, 338(6107). https://doi.org/10.1126/science.1222426",original,26,"‘[Some consequences of having too little](https://doi.org/10.1126/science.1222426)’, Shah et al. (2012); 5 experiments with Study 1: n=60; Study 2: n=68; Study 3: n=143; Study 4: n=118; Study 5: n=137 [citations=1403 (GS, April 2022)]."
Poverty Impedes Cognitive Function.,2013,,"Mani, Anandi and Mullainathan, Sendhil and Shafir, Eldar and Zhao, Jiaying",10.1126/science.1238041,http://dx.doi.org/10.1126/science.1238041,Science,976-980,341,6149,1311,NA,NA,NA,Mani et al. (2013),"Mani, A., Mullainathan, S., Shafir, E., Zhao, J. (2013). Poverty Impedes Cognitive Function.. Science, 341(6149). https://doi.org/10.1126/science.1238041",original,27,"‘[Poverty impedes cognitive function’](https://doi.org/10.1126/science.1238041), Mani et al. (2013) Study 4, with n=96. [citation=2332(GS, November 2021)]​."
Learning About What Others Were Doing.Verb Aspect and Attributions of Mundane and Criminal Intent for Past Actions,2010,,"Hart, William and Albarracín, Dolores",10.1177/0956797610395393,http://dx.doi.org/10.1177/0956797610395393,Psychological Science,261-266,22,2,17,"citations = 37, (GS, January 2022)",NA,NA,Hart & Albarracín (2010),"Hart, W., Albarracín, D. (2010). Learning About What Others Were Doing.Verb Aspect and Attributions of Mundane and Criminal Intent for Past Actions. Psychological Science, 22(2). https://doi.org/10.1177/0956797610395393",original,28,"‘[Learning about what others were doing: Verb aspect and attributions of mundane and criminal intent for past actions](https://journals.sagepub.com/doi/full/10.1177/0956797610395393)’, Hart and Albarracin (2011): 3 experiments with Study 1: n = 5458; Study 2: n = 37; Study 3: n = 48. [citations = 37, (GS, January 2022)]."
Scarcity Frames Value.,2015,,"Shah, Anuj K. and Shafir, Eldar and Mullainathan, Sendhil",10.1177/0956797614563958,http://dx.doi.org/10.1177/0956797614563958,Psychological Science,402-412,26,4,192,NA,NA,NA,Shah et al. (2015),"Shah, A. K., Shafir, E., Mullainathan, S. (2015). Scarcity Frames Value.. Psychological Science, 26(4). https://doi.org/10.1177/0956797614563958",original,29,"‘[Scarcity frames value](https://doi.org/10.1177/0956797614563958)’, Shah et al. (2015) with n=73. [citation=315(GS, November 2021)]​."
Economic Insecurity Increases Physical Pain.,2016,,"Chou, Eileen Y. and Parmar, Bidhan L. and Galinsky, Adam D.",10.1177/0956797615625640,http://dx.doi.org/10.1177/0956797615625640,Psychological Science,443-454,27,4,63,NA,NA,NA,Chou et al. (2016),"Chou, E. Y., Parmar, B. L., Galinsky, A. D. (2016). Economic Insecurity Increases Physical Pain.. Psychological Science, 27(4). https://doi.org/10.1177/0956797615625640",original,30,"‘[Economic insecurity increases physical pain](https://doi.org/10.1177/0956797615625640)’, Chou et al. (2016 ) Study 3, with n=231. [citation=103(GS, November 2021)]​."
Revisiting the Red Effect on Attractiveness and Sexual Receptivity.No Effect of the Color Red on Human Mate Preferences,2016,,"Peperkoorn, Leonard S. and Roberts, S. Craig and Pollet, Thomas V.",10.1177/1474704916673841,http://dx.doi.org/10.1177/1474704916673841,Evolutionary Psychology,147470491667384,14,4,26,NA,NA,NA,Peperkoorn et al. (2016),"Peperkoorn, L. S., Roberts, S. C., Pollet, T. V. (2016). Revisiting the Red Effect on Attractiveness and Sexual Receptivity.No Effect of the Color Red on Human Mate Preferences. Evolutionary Psychology, 14(4). https://doi.org/10.1177/1474704916673841",replication,31,"[Peperkoorn et al. (2016)](https://doi.org/10.1177/1474704916673841) [n=830, citations=48 (GS, February 2022)]. ​"
Registered Replication Report.Hart &amp; Albarracín (2011),2016,,"Eerland, A. and Sherrill, A. M. and Magliano, J. P. and Zwaan, R. A. and Arnal, J. D. and Aucoin, P. and Berger, S. A. and Birt, A. R. and Capezza, N. and Carlucci, M. and Crocker, C. and Ferretti, T. R. and Kibbe, M. R. and Knepp, M. M. and Kurby, C. A. and Melcher, J. M. and Michael, S. W. and Poirier, C. and Prenoveau, J. M.",10.1177/1745691615605826,http://dx.doi.org/10.1177/1745691615605826,Perspectives on Psychological Science,158-171,11,1,30,NA,NA,NA,Eerland et al. (2016),"Eerland, A., Sherrill, A. M., Magliano, J. P., Zwaan, R. A., Arnal, J. D., Aucoin, P., Berger, S. A., Birt, A. R., Capezza, N., Carlucci, M., Crocker, C., Ferretti, T. R., Kibbe, M. R., Knepp, M. M., Kurby, C. A., Melcher, J. M., Michael, S. W., Poirier, C., Prenoveau, J. M. (2016). Registered Replication Report.Hart &amp; Albarracín (2011). Perspectives On Psychological Science, 11(1). https://doi.org/10.1177/1745691615605826",replication,32,"[Eerland et al. (2016) ](https://journals.sagepub.com/doi/pdf/10.1177/1745691615605826) [meta analysis (total n= 685 for perfective-aspect condition; n = 681 imperfective-aspect condition) of Study 3 citations = 70, (GS, January, 2022)]"
